259;7.4.4.svg;7.4.4;Вид транспортного средства;"Указывают вид транспортного средства, на который распространяется действие знака.  Табличка 7.4.1 распространяет действие знака на грузовые автомобили (в том числе с прицепом) с технически допустимой общей массой свыше 3,5 т. Табличка 7.4.3 — на легковые автомобили, а также на грузовые автомобили с технически допустимой общей массой до 3,5 т включительно. Табличка 7.4.8 — на транспортные средства, оборудованные опознавательными знаками «Опасный груз»."
260;7.4.5.svg;7.4.5;Вид транспортного средства;"Указывают вид транспортного средства, на который распространяется действие знака.  Табличка 7.4.1 распространяет действие знака на грузовые автомобили (в том числе с прицепом) с технически допустимой общей массой свыше 3,5 т. Табличка 7.4.3 — на легковые автомобили, а также на грузовые автомобили с технически допустимой общей массой до 3,5 т включительно. Табличка 7.4.8 — на транспортные средства, оборудованные опознавательными знаками «Опасный груз»."
261;7.4.6.svg;7.4.6;Вид транспортного средства;"Указывают вид транспортного средства, на который распространяется действие знака.  Табличка 7.4.1 распространяет действие знака на грузовые автомобили (в том числе с прицепом) с технически допустимой общей массой свыше 3,5 т. Табличка 7.4.3 — на легковые автомобили, а также на грузовые автомобили с технически допустимой общей массой до 3,5 т включительно. Табличка 7.4.8 — на транспортные средства, оборудованные опознавательными знаками «Опасный груз»."
262;7.4.7.svg;7.4.7;Вид транспортного средства;"Указывают вид транспортного средства, на который распространяется действие знака.  Табличка 7.4.1 распространяет действие знака на грузовые автомобили (в том числе с прицепом) с технически допустимой общей массой свыше 3,5 т. Табличка 7.4.3 — на легковые автомобили, а также на грузовые автомобили с технически допустимой общей массой до 3,5 т включительно. Табличка 7.4.8 — на транспортные средства, оборудованные опознавательными знаками «Опасный груз»."
263;7.4.8.svg;7.4.8;Вид транспортного средства;"Указывают вид транспортного средства, на который распространяется действие знака.  Табличка 7.4.1 распространяет действие знака на грузовые автомобили (в том числе с прицепом) с технически допустимой общей массой свыше 3,5 т. Табличка 7.4.3 — на легковые автомобили, а также на грузовые автомобили с технически допустимой общей массой до 3,5 т включительно. Табличка 7.4.8 — на транспортные средства, оборудованные опознавательными знаками «Опасный груз»."
264;7.4.9.svg;7.4.9;"Транспортное средство, приводимое в движение электродвигателем";Электромобиль. Рекомендательный[9].
265;7.5.1.svg;7.5.1;"Субботние, воскресные и праздничные дни";"Указывают дни недели, в течение которых действует знак."
266;7.5.2.svg;7.5.2;Рабочие дни;
267;7.5.3.svg;7.5.3;Дни недели;
268;7.5.4.svg;7.5.4;Время действия;"Указывает время суток, в течение которого действует знак."
269;7.5.5.svg;7.5.5;Время действия;"Указывают дни недели и время суток, в течение которых действует знак."
270;7.5.6.svg;7.5.6;Время действия;"Указывают дни недели и время суток, в течение которых действует знак."
271;7.5.7.svg;7.5.7;Время действия;"Указывают дни недели и время суток, в течение которых действует знак."
272;7.6.1 (7.6.10).svg;7.6.1 (7.6.10);Способ постановки транспортного средства на стоянку;"Указывает, что все транспортные средства должны быть поставлены на стоянку на проезжей части вдоль тротуара."
273;7.6.2 (7.6.11).svg;7.6.2 (7.6.11);Способ постановки транспортного средства на стоянку;Указывают способ постановки легковых автомобилей и мотоциклов на околотротуарной стоянке.Остановка и стоянка других транспортных средств запрещаются.
274;7.6.3 (7.6.12).svg;7.6.3 (7.6.12);Способ постановки транспортного средства на стоянку;Указывают способ постановки легковых автомобилей и мотоциклов на околотротуарной стоянке.Остановка и стоянка других транспортных средств запрещаются.
275;7.6.4 (7.6.13).svg;7.6.4 (7.6.13);Способ постановки транспортного средства на стоянку;Указывают способ постановки легковых автомобилей и мотоциклов на околотротуарной стоянке.Остановка и стоянка других транспортных средств запрещаются.
276;7.6.5 (7.6.14).svg;7.6.5 (7.6.14);Способ постановки транспортного средства на стоянку;Указывают способ постановки легковых автомобилей и мотоциклов на околотротуарной стоянке.Остановка и стоянка других транспортных средств запрещаются.
277;7.6.6 (7.6.15).svg;7.6.6 (7.6.15);Способ постановки транспортного средства на стоянку;Указывают способ постановки легковых автомобилей и мотоциклов на околотротуарной стоянке.Остановка и стоянка других транспортных средств запрещаются.
278;7.6.7 (7.6.16).svg;7.6.7 (7.6.16);Способ постановки транспортного средства на стоянку;Указывают способ постановки легковых автомобилей и мотоциклов на околотротуарной стоянке.Остановка и стоянка других транспортных средств запрещаются.
279;7.6.8 (7.6.17).svg;7.6.8 (7.6.17);Способ постановки транспортного средства на стоянку;Указывают способ постановки легковых автомобилей и мотоциклов на околотротуарной стоянке.Остановка и стоянка других транспортных средств запрещаются.
280;7.6.9 (7.6.18).svg;7.6.9 (7.6.18);Способ постановки транспортного средства на стоянку;Указывают способ постановки легковых автомобилей и мотоциклов на околотротуарной стоянке.Остановка и стоянка других транспортных средств запрещаются.
281;7.7.svg;7.7;Количество опасных поворотов;"Устанавливается со знаками 1.12.1, 1.12.2 и информирует о количестве опасных поворотов, расположенных один за другим."
282;7.8.svg;7.8;Платные услуги;"Указывает, что услуги предоставляются только за наличный расчет."
283;7.9.svg;7.9;Ограничение продолжительности стоянки;"Указывает максимальную продолжительность пребывания транспортного средства на стоянке, обозначенной знаком 5.15."
284;7.10.svg;7.10;Место для осмотра автомобилей;"Указывает, что на площадке, обозначенной знаком 5.15 или 6.11, имеется эстакада или смотровая канава для осмотра транспортных средств."
285;7.11.svg;7.11;Ограничение разрешенной максимальной массы;"Указывает, что действие знака распространяется только на транспортные средства с фактической массой более обозначенной на табличке."
286;7.12.svg;7.12;Нанесение разметки;Устанавливается со знаком 1.23 и информирует о проведении работ по нанесению дорожной разметки.
287;7.13.svg;7.13;Направление главной дороги;"Устанавливается со знаками 2.1, 2.4, 2.5 и указывает направление главной дороги на перекрестке."
288;7.14.svg;7.14;Полоса движения;"Указывает полосу движения, на которую распространяется действие знака или светофора."
289;7.15.svg;7.15;Пешеходы-инвалиды по зрению;"Указывает, что пешеходным переходом часто пользуются инвалиды по зрению. Применяется со знаками 1.20, 5.16.1, 5.16.2 и светофорами."
290;7.16.svg;7.16;Влажное покрытие;"Указывает, что действие знака распространяется только на период времени, когда покрытие проезжей части дороги является влажным."
291;7.17.svg;7.17;Инвалиды;"Используется с дорожным знаком 5.15 и информирует, что стояночная площадка или её часть отведена для стоянки транспортных средств с опознавательным знаком «Инвалид»."
292;7.18.svg;7.18;Кроме инвалидов;"Указывает, что действие знака не распространяется на транспортные средства с опознавательным знаком «Инвалид»."
293;7.19.svg;7.19;Класс опасного груза;"Устанавливается со знаком 3.32 и указывает номер класса опасного груза (согласно ГОСТ 19433-88), с которым движение транспортных средств запрещено."
294;7.20.svg;7.20;Эвакуатор;Устанавливается со знаками 3.27—3.30 и информирует о возможной эвакуации (блокировке колес) транспортного средства при отсутствии водителя в транспортном средстве или в непосредственной близости от него.
295;7.21.svg;7.21;Скользкая полоса наката;Устанавливается со знаком 1.23 и информирует о возможном изменении коэффициента сцепления по ширине проезжей части дороги.
296;7.22.1.svg;7.22.1;Вид опасности;Устанавливается со знаком 1.29 и информирует о возможном виде дорожно-транспортного происшествия.
297;7.22.2.svg;7.22.2;Вид опасности;Устанавливается со знаком 1.29 и информирует о возможном виде дорожно-транспортного происшествия.
298;7.22.3.svg;7.22.3;Вид опасности;Устанавливается со знаком 1.29 и информирует о возможном виде дорожно-транспортного происшествия.
299;7.22.4.svg;7.22.4;Вид опасности;Устанавливается со знаком 1.29 и информирует о возможном виде дорожно-транспортного происшествия.
300;7.23.svg;7.23;Экстренная помощь;Информирует о наличии экстренной связи на дороге.
301;7.24.svg;7.24;Служите примером своему ребёнку;"Рекомендательный[9]. Размещается на пешеходном переходе рядом со школой, детским дошкольным учреждением и учреждением здравоохранения, передней стороной к пешеходам."
302;7.25.svg;7.25;Количество разрешенных мест для стоянки;Рекомендательный[9].
