163;5.11.1.svg;5.11.1;Место для разворота;"Обозначает разрыв в разделительной зоне, разделительной полосе или часть перекрёстка, где разрешён разворот."
164;5.11.2.svg;5.11.2;Зона для разворота;Начало зоны для разворота транспортных средств и её длина.
165;5.12.1.svg;5.12.1;Остановочный пункт автобуса и (или) троллейбуса;"Знак обозначает начало посадочной площадки остановочного пункта автобуса и (или) троллейбуса. Вне населённых пунктов знак может быть установлен на павильоне со стороны прибытия маршрутных транспортных средств.В нижней части знака может быть нанесено изображение таблички 7.2.1 с указанием расстояния, равного протяжённости посадочной площадки. Знак может иметь расписание по желанию издателя знака."
166;5.12.2.svg;5.12.2;Место остановки автобуса и (или) троллейбуса;"Знак устанавливается вместо знака 5.12.1. Это знак 5.12.1, где под белым квадратом изображены буквы «А» или «Т». Автобус — буквенный индекс «А». Троллейбус — «Т». Также на знаке написано расписание движения."
167;5.13.1.svg;5.13.1;Остановочный пункт трамвая;"Знак обозначает начало зоны остановочного пункта трамвая. В нижней части знака может быть нанесено изображение таблички 7.2.1 с указанием расстояния, равного протяжённости зоны остановочного пункта трамвая. По желанию издателя может быть расписание."
168;5.13.2.svg;5.13.2;Место остановки трамвая;Знак может устанавливаться в конце зоны остановочного пункта трамвая. Под знаком размещается табличка с информацией о маршрутах и режиме движения трамваев (расписание).
169;5.14.1.svg;5.14.1;Остановочный пункт экспресс-маршрута;"Знак обозначает начало посадочной площадки остановочного пункта транспортного средства, осуществляющего движение в регулярном экспрессном сообщении.Данный остановочный пункт может быть обозначен двумя знаками 5.14.1, установленными в начале и в конце посадочной площадки. В этом случае в нижней части первого по ходу движения знака может быть нанесено изображение таблички 7.2.1 с указанием протяжённости посадочной площадки, а также информация о количестве транспортных средств, которым разрешено одновременно находиться на остановочном пункте."
170;5.14.2.svg;5.14.2;Место стоянки такси;"Знак обозначает зону на проезжей части дороги или специальную площадку, предназначенную только для стоянки такси. На знаке может быть указано количество такси, которым разрешено одновременно находиться на стоянке.В населённых пунктах зона стоянки такси может быть обозначена двумя знаками 5.14.2, один из которых устанавливается в начале зоны с табличкой 7.2.1, второй — в конце зоны стоянки."
171;5.15.svg;5.15;Место стоянки;"Знак обозначает специальную площадку, зону на проезжей части дороги или на тротуаре, которые отведены для стоянки транспортных средств. Для уточнения направления движения, расстояния до специальной площадки и разрешённых на ней условий стоянки со знаком 5.15 могут применяться таблички."
172;5.16.1.svg;5.16.1;Пешеходный переход;"Знаки обозначают зону для перехода пешеходами проезжей части дороги. На пешеходных переходах шириной более 10 метров со знаком 5.16.2 может быть установлена табличка 7.2.1 или 7.2.2, на которой указывается ширина зоны пешеходного перехода."
173;5.16.2.svg;5.16.2;;
174;5.17.1.svg;5.17.1;Подземный пешеходный переход;"Указывает место, где пешеходы могут безопасно перейти дорогу при помощи подземного пешеходного перехода."
175;5.17.2.svg;5.17.2;;
176;5.17.3.svg;5.17.3;Надземный пешеходный переход;"Указывает место, где пешеходы могут безопасно перейти дорогу при помощи надземного пешеходного перехода."
177;5.17.4.svg;5.17.4;;
178;5.18.1.svg;5.18.1;Рекомендуемая скорость;"Скорость, с которой рекомендуется движение на данном участке дороги. Зона действия знака распространяется до знака 5.18.2 либо до знака 5.18.1 с другим значением рекомендуемой скорости или до ближайшего обозначенного перекрестка, а при применении знака 5.18.1 с предупреждающим знаком определяется протяжённостью опасного участка дороги."
179;5.18.2.svg;5.18.2;Конец действия знака «Рекомендуемая скорость»;Конец зоны действия знака «Рекомендуемая скорость»
180;5.19.1.svg;5.19.1;Тупик;"Указывает участок дороги, где невозможно сквозное движение, не запрещая при этом движение в направлении тупика."
181;5.19.2.svg;5.19.2;Тупик;"Указывает участок дороги, где невозможно сквозное движение, не запрещая при этом движение в направлении тупика."
182;5.19.3.svg;5.19.3;Тупик;"Указывает участок дороги, где невозможно сквозное движение, не запрещая при этом движение в направлении тупика."
183;5.20.3.svg;5.20.3;Схема движения;"Маршрут движения на перекрестке в случае запрещения отдельных манёвров, указание разрешённых направлений движения на перекрестке со сложной планировкой."
184;5.20.4.svg;5.20.4;Схема движения к пункту обслуживания системы электронного сбора платы за проезд;Указывает направление движения к пункту обслуживания системы BelToll. Рекомендательный[9].
185;5.21.1.svg;5.21.1;Указатель направления;"Указывает направление (направления) движения к населённым пунктам или другим объектам. На знаках могут быть нанесены расстояния до указанных на них объектов (км), символы автомагистрали, аэропорта, изображения знаков 5.29.1, 5.29.2, а также других символов и знаков, информирующих об особенностях дорожного движения."
186;5.21.2.svg;5.21.2;Указатель направлений;
187;5.22.1.svg;5.22.1;Начало населённого пункта;"Начало населённого пункта, в котором действуют специальные требования Правил, устанавливающие порядок дорожного движения в населённых пунктах."
188;5.22.2.svg;5.22.2;Начало населённого пункта;
189;5.23.1.svg;5.23.1;Конец населённого пункта;"Место дороги, с которого утрачивают силу специальные требования Правил, устанавливающие порядок дорожного движения в населённых пунктах."
190;5.23.2.svg;5.23.2;Конец населённого пункта;
191;5.24.svg;5.24;Начало границы населённого пункта;"Начало границы населённого пункта, при движении по которому на данной дороге не действуют специальные требования Правил, устанавливающие порядок дорожного движения в населённых пунктах."
192;5.25.svg;5.25;Конец границы населённого пункта;"Конец границы населённого пункта, обозначенного знаком 5.24."
193;5.26.1.svg;5.26.1;Наименование объекта;"Наименование объекта, не являющегося населённым пунктом (река, озеро, достопримечательности и т. п.), а также обозначение границ административно-территориальных и территориальных единиц."
194;5.26.2.svg;5.26.2;Наименование объекта;"Наименование объекта в населённом пункте (название улицы, театра, музея и т. п.)."
195;5.27.svg;5.27;Указатель расстояний;Расстояние до населённых пунктов или других объектов (км).
196;5.28.svg;5.28;Километровый знак;Расстояние от начала дороги (км).
197;5.29.1.svg;5.29.1;Номер дороги;"Номер дороги, на которой установлен данный знак.На знаках 5.29.1, 5.29.3 с зелёным фоном указывается номер дороги, включенной в Европейскую систему автомобильных магистралей, с красным фоном — номер магистральной или республиканской дороги, с белым фоном — номер местной дороги."
198;5.29.2.svg;5.29.2;Номер дороги;"Номер дороги, в направлении к которой осуществляется движение."
199;5.29.3.svg;5.29.3;Номер и направление дороги;Указывает направление дороги (синий фон — направление в сторону дороги) с соответствующим номером.
200;5.30.1.svg;5.30.1;Направление движения грузовых автомобилей;"Рекомендуемое направление движения для грузовых автомобилей, тракторов и самоходных машин, если на перекрестке их движение в одном из направлений запрещено."
201;5.30.2.svg;5.30.2;Направление движения грузовых автомобилей;"Рекомендуемое направление движения для грузовых автомобилей, тракторов и самоходных машин, если на перекрестке их движение в одном из направлений запрещено."
202;5.30.3.svg;5.30.3;Направление движения грузовых автомобилей;"Рекомендуемое направление движения для грузовых автомобилей, тракторов и самоходных машин, если на перекрестке их движение в одном из направлений запрещено."
203;5.31.svg;5.31;Схема объезда;"Маршрут объезда участка дороги, временно закрытого для движения."
204;5.32.1.svg;5.32.1;Направление объезда;"Направление объезда участка дороги, временно закрытого для движения."
205;5.32.2.svg;5.32.2;Направление объезда;"Направление объезда участка дороги, временно закрытого для движения."
206;5.32.3.svg;5.32.3;Направление объезда;"Направление объезда участка дороги, временно закрытого для движения."
207;5.33.svg;5.33;Стоп-линия;"Место остановки транспортных средств при запрещающем сигнале регулировщика, светофора."
208;5.34.1.svg;5.34.1;Предварительный указатель перестроения на другую проезжую часть;"Направление объезда участка проезжей части дороги с разделительной полосой, временно закрытого для движения."
209;5.34.2.svg;5.34.2;Предварительный указатель перестроения на другую проезжую часть;Направление движения для возвращения на правую проезжую часть дороги.
210;5.35.svg;5.35;Реверсивное движение;"Начало участка дороги, на котором на одной или нескольких полосах направление движения может изменяться на противоположное."
211;5.36.svg;5.36;Конец реверсивного движения;"Конец участка дороги, обозначенного знаком 5.35."
212;5.37.svg;5.37;Выезд на дорогу с реверсивным движением;"Выезд на участок дороги, на котором на одной или нескольких полосах направление движения может изменяться на противоположное."
213;5.38.svg;5.38;Жилая зона;"Знаки информируют соответственно о начале и конце территории, на которой действуют специальные требования Правил, устанавливающие порядок дорожного движения в жилых зонах[19]."
214;5.39.svg;5.39;Конец жилой зоны;
215;5.40.svg;5.40;Пешеходная зона;"Знаки информируют соответственно о начале и конце территории, на которой действуют специальные требования Правил, устанавливающие порядок дорожного движения в пешеходных зонах[19]."
216;5.41.svg;5.41;Конец пешеходной зоны;
217;5.42.svg;5.42;Платная автомобильная дорога;"Знак информирует о начале участка дороги, на котором используется система электронного сбора платы в режиме свободного многополосного движения за проезд транспортных средств."
218;5.43.svg;5.43;Конец платной автомобильной дороги;"Знак информирует о конце участка дороги, на котором используется система электронного сбора платы в режиме свободного многополосного движения за проезд транспортных средств."
219;5.44.svg;5.44;Указатель направления к пункту обслуживания системы электронного сбора платы за проезд;Рекомендательный[9].
220;6.1.svg;6.1;Пункт первой медицинской помощи;
221;6.2.svg;6.2;Больница;
222;6.3.1.svg;6.3.1;Автозаправочная станция;Автозаправочная станция (только жидкое топливо)
223;6.3.2.svg;6.3.2;Газовая автозаправочная станция (только газ);
224;6.3.3.svg;6.3.3;Совместная автозаправочная станция (жидкое топливо и газ);
225;6.3.4.svg;6.3.4;Станция для зарядки;Рекомендательный[9].
226;6.3.5.svg;6.3.5;"Автозаправочная станция, совмещённая со станцией для зарядки";Рекомендательный[9]. Жидкое топливо и электрозарядка.
227;6.3.6.svg;6.3.6;Рекомендательный[9]. Газ и электрозарядка.;
228;6.3.7.svg;6.3.7;"Рекомендательный[9]. Жидкое топливо, газ и электрозарядка.";
229;6.4.svg;6.4;Техническое обслуживание автомобилей;
230;6.5.svg;6.5;Мойка автомобилей;
231;6.6.svg;6.6;Телефон;
232;6.7.svg;6.7;Пункт питания;
233;6.8.svg;6.8;Питьевая вода;
234;6.9.svg;6.9;Гостиница или мотель;
235;6.10.svg;6.10;Кемпинг;
236;6.11.svg;6.11;Место отдыха;
237;6.12.1.svg;6.12.1;Милиция;
238;6.12.2.svg;6.12.2;ГАИ;
239;6.13.svg;6.13;Туалет;
240;6.14.svg;6.14;Пункт контроля автомобильных перевозок;
241;6.15.svg;6.15;Достопримечательность;
242;6.16.svg;6.16;Пункт обслуживания системы электронного сбора платы за проезд;Рекомендательный[9].
243;7.1.1.svg;7.1.1;Расстояние до объекта;"Указывает расстояние от знака до начала опасного участка дороги или до места, с которого начинает действовать ограничение дорожного движения, или до определённого объекта (места), расположенного по ходу движения."
244;7.1.2.svg;7.1.2;Расстояние до объекта;"Указывает расстояние от знака 2.4 до перекрестка в случае, если непосредственно перед перекрестком установлен знак 2.5."
245;7.1.3.svg;7.1.3;Расстояние до объекта;"Указывает расстояние до объекта, находящегося в стороне от дороги."
246;7.1.4.svg;7.1.4;Расстояние до объекта;"Указывает расстояние до объекта, находящегося в стороне от дороги."
247;7.2.1.svg;7.2.1;Зона действия;"Указывает протяжённость опасного участка дороги, обозначенного предупреждающими знаками, или зону действия запрещающих, предписывающих либо информационно-указательных знаков."
248;7.2.2.svg;7.2.2;Зона действия;"Указывает зону действия знаков 3.27-3.30, если она не распространяется до ближайшего обозначенного перекрестка, а также ширину зоны пешеходного перехода, обозначенного знаками 5.16.1, 5.16.2."
249;7.2.3.svg;7.2.3;Зона действия;Указывает конец зоны действия знаков 3.27-3.30.
250;7.2.4.svg;7.2.4;Зона действия;Информирует водителей о нахождении транспортных средств в зоне действия знаков 3.27-3.30.
251;7.2.5.svg;7.2.5;Зона действия;Указывают направление и зону действия знаков 3.27-3.30 справа и (или) слева от них.
252;7.2.6.svg;7.2.6;;Указывают направление и зону действия знаков 3.27-3.30 справа и (или) слева от них.
253;7.3.1.svg;7.3.1;Направления действия;"Указывают направления действия знаков, установленных перед перекрёстком или направления движения к обозначенным объектам, находящимся непосредственно у дороги."
254;7.3.2.svg;7.3.2;Направления действия;
255;7.3.3.svg;7.3.3;Направления действия;
256;7.4.1.svg;7.4.1;Вид транспортного средства;"Указывают вид транспортного средства, на который распространяется действие знака.  Табличка 7.4.1 распространяет действие знака на грузовые автомобили (в том числе с прицепом) с технически допустимой общей массой свыше 3,5 т. Табличка 7.4.3 — на легковые автомобили, а также на грузовые автомобили с технически допустимой общей массой до 3,5 т включительно. Табличка 7.4.8 — на транспортные средства, оборудованные опознавательными знаками «Опасный груз»."
257;7.4.2.svg;7.4.2;Вид транспортного средства;"Указывают вид транспортного средства, на который распространяется действие знака.  Табличка 7.4.1 распространяет действие знака на грузовые автомобили (в том числе с прицепом) с технически допустимой общей массой свыше 3,5 т. Табличка 7.4.3 — на легковые автомобили, а также на грузовые автомобили с технически допустимой общей массой до 3,5 т включительно. Табличка 7.4.8 — на транспортные средства, оборудованные опознавательными знаками «Опасный груз»."
258;7.4.3.svg;7.4.3;Вид транспортного средства;"Указывают вид транспортного средства, на который распространяется действие знака.  Табличка 7.4.1 распространяет действие знака на грузовые автомобили (в том числе с прицепом) с технически допустимой общей массой свыше 3,5 т. Табличка 7.4.3 — на легковые автомобили, а также на грузовые автомобили с технически допустимой общей массой до 3,5 т включительно. Табличка 7.4.8 — на транспортные средства, оборудованные опознавательными знаками «Опасный груз»."
